title,query_subject,subjects,keywords,cited_by
Tailoring Physicochemical Properties of Iloperidone by Cocrystallization: Design and Characterization of Novel Cocrystals of Iloperidone and 4-amino Benzoic Acid,ENGI,Unknown,None,1
Railway Tunnels,ENGI,Unknown,None,0
Structural Comparison of Naturally Aspirated and Turbocharged Diesel Engine for Steel and Aluminium Made Radiator: A Finite Element Study,ENGI,Unknown,None,0
The Thin Moral Concept of Evil,ENGI,Unknown,None,0
Evidence for Professional Conceptualization in Science as an Important Component of Science Identity,ENGI,Unknown,None,8
Exploring Student Service Member/Veteran Social Support and Campus Belonging in University STEMM Fields,ENGI,Unknown,None,1
Identifying immunodominant multi-epitopes from the envelope glycoprotein of the Lassa mammarenavirus as vaccine candidate for Lassa fever,ENGI,Unknown,None,2
Japan’s Forgotten God: Jūzenji in Medieval Texts and the Visual Arts,ENGI,Unknown,None,0
Determination of twelve mycotoxins in red and green Sichuan peppers using QuEChERS method with LC-MS/MS,ENVI,Unknown,None,0
"Investigating the effect of the physical layout of the architecture of high-rise buildings, residential complexes, and urban heat islands",ENVI,Unknown,None,4
Influence of university campus spatial morphology on outdoor thermal environment: A case study from Eastern China,ENVI,Unknown,None,2
Health-Oriented Walkability Measurement and Enhancement Strategies for Life Circle,ENVI,Unknown,None,0
"How does shade infrastructure affect outdoor thermal comfort during hot, humid summers? Evidence from Nanjing, China",ENVI,Unknown,None,0
Evaluating the cooling performance of vegetation combined with a fountain in horizontal and vertical urban environments,ENVI,Unknown,None,0
Multi-dimensional distribution prediction of PM2.5 concentration in urban residential areas based on CNN,ENVI,Unknown,None,0
Quantifying the impact of vertical greenery systems (VGS) on Mediterranean urban microclimate during heat wave events,ENVI,Unknown,None,0
"How small green spaces cool urban neighbourhoods: Optimising distribution, size and shape",ENVI,Unknown,None,0
Effects of vertical greening on the thermal environment and energy consumption in different street canyons,ENVI,Unknown,None,0
Exploring the regional cooling efficiency of urban residential vegetation using scenario simulation,ENVI,Unknown,None,0
Decoding outdoor thermal comfort: The role of location in urban canyon microclimate,ENVI,Unknown,None,0
"Dynamics of Shoreline Changes Along the Coast of Subarnarekha and Budhabalanga River Estuary, North Eastern Coast of India Using DSAS Technique: A Geospatial Technology Approach",ENVI,Unknown,None,0
"Exposure, spatial distribution, and health risks of perfluoroalkyl acids in commercial fish species in the Beibu Gulf",ENVI,Unknown,None,0
"Identifying groundwater characteristics and controlling factors in Jiaozhou Bay’s northern coastal region, China: a combined approach of multivariate statistics, isotope analysis, and field empirical investigations",ENVI,Unknown,None,0
Proposing design strategies for contemporary courtyards based on thermal comfort in cold and semi-arid climate zones,ENVI,Unknown,None,0
Development of predictive indices for evaluating the UHI adaptation potential of green roof- and wall-based scenarios in the Mediterranean climate,ENVI,Unknown,None,0
Modifying School Courtyard Design to Optimize Thermal Conditions and Energy Consumption in a Hot Arid Climate,ENVI,Unknown,None,1
Assessing the efficacy of green walls versus street green lanes in mitigating air pollution: A critical evaluation,ENVI,Unknown,None,1
"Optimizing human thermal comfort and mitigating the urban heat island effect on public open spaces in Rome, Italy through sustainable design strategies",ENVI,Unknown,None,1
Evaluating the impact of evolving green and grey urban infrastructure on local particulate pollution around city square parks,ENVI,Unknown,None,0
Coupled InVEST–MGWR modeling to analyze the impacts of changing landscape patterns on habitat quality in the Fen River basin,ENVI,Unknown,None,2
Optimizing an efficient urban tree strategy to improve microclimate conditions while considering water scarcity: a case study of Cairo,ENVI,Unknown,None,1
"Gender, sexuality, and food access: An exploration of food security with LGBTQIA2S+ university students",ENVI,Unknown,None,0
ResNet incorporating the fusion data of RGB &amp; hyperspectral images improves classification accuracy of vegetable soybean freshness,ENVI,Unknown,None,7
Understanding the impacts of street greening patterns and wind directions on the dispersion of fine particles,ENVI,Unknown,None,0
Simulating the impact of ventilation corridors for cooling air temperature in local climate zone scheme,ENVI,Unknown,None,0
Annual cyclical variations of urban green space cold island(GSCI) effect by combining remote sensing inversion and ENVI-met simulation,ENVI,Unknown,None,1
Mathematical models for traffic-source PM<inf>2.5</inf> dispersion in an urban street canyon considering the capture capability of roadside trees,ENVI,Unknown,None,0
Evaluating the Extraction and Quantification of Marine Surfactants from Seawater through Solid Phase Extraction and Subsequent Colorimetric Analyses,ENVI,Unknown,None,0
The Impact of Different Types of Trees on Annual Thermal Comfort in Hot Summer and Cold Winter Areas,ENVI,Unknown,None,0
The Influence of the Spatial Morphology of Township Streets on Summer Microclimate and Thermal Comfort,ENVI,Unknown,None,0
Extraction of Canal Distribution Information Based on UAV Remote Sensing System and Object-Oriented Method,ENVI,Unknown,None,0
A semi-automated method using object-based image analysis (OBIA) to detect and enumerate beluga whales in summer from very high-resolution (VHR) satellite imagery,ENVI,Unknown,None,0
"Estimating impacts of micro-scale land use/land cover change on urban thermal comfort zone in Rajshahi, Bangladesh: A GIS and remote sensing based approach",ENVI,Unknown,None,0
"Sensitivity analysis of building material, ground material, and tree parameters in microclimate simulations",ENVI,Unknown,None,0
"The impact of urban morphology on thermal environment under extreme heat: A case study in Nanjing, China",ENVI,Unknown,None,0
Street trees: The contribution of latent heat flux to cooling dense urban areas,ENVI,Unknown,None,0
THE IMPACT OF IT EXPORTS ON ECONOMIC DEVELOPMENT: A COMPARATIVE ANALYSIS OF UKRAINE AND EUROPEAN COUNTRIES,ENVI,Unknown,None,0
"Outdoor Thermal Comfort and Sustainability of Urban Village Life in The Small Ancient City at Tropic Area Yogyakarta, Indonesia: Approach with ENVI-Met",ENVI,Unknown,None,0
"Exploring wetland change in the Gauteng Province, South Africa",ENVI,Unknown,None,0
Intelligent marine detection based on spectral imaging and neural network modeling,ENVI,Unknown,None,0
"Transferring and transformation of nitrogen and phosphorus of wastewater in microalgae, and microalgae-bacteria consortia system",ENVI,Unknown,None,0
Research on Multi-objective Collaborative Optimization of Construction Process of Technical Interfaces in Railway Engineering,ENVI,Unknown,None,0
Case Study for Adopting a Sustainable Kindergarten Design in Baghdad to Improve Thermal Comfort,ENVI,Unknown,None,0
Research on Thermal Comfort Evaluation and Optimization of Green Space in Beijing Dashilar Historic District,ENVI,Unknown,None,0
Vertical Plant Configuration: Its Impact on Microclimate and Thermal Comfort in Urban Small Green Spaces,ENVI,Unknown,None,0
Research into the Influence Mechanisms of Visual-Comfort and Landscape Indicators of Urban Green Spaces,ENVI,Unknown,None,0
"Is LCZ Enough? Physical Properties, Thermal Environments and Cooling Effects of Green Roofs in High-Density Urban Industrial Blocks",ENVI,Unknown,None,0
MITIGATING THE URBAN HEAT ISLAND EFFECT: The Thermal Performance of Shade-Tree Planting in Downtown Los Angeles,ENVI,Unknown,None,0
Impact of ENVI-met-Based Road Greening Design on Thermal Comfort and PM<inf>2.5</inf> Concentration in Hot–Humid Areas,ENVI,Unknown,None,0
Analysis of changes and driving forces of landscape pattern vulnerability at Qianping Reservoir in Central China,ENVI,Unknown,None,0
Thermal environmental and energy effects of vertical greening system under the influence of localized urban climates,ENVI,Unknown,None,1
"Explorations on cooling effect of small urban linear park design in low-rise, high-density district: The case of Gyeongui line forest park in Seoul",ENVI,Unknown,None,1
Characterization of The Permeation Properties of Membrane Filters and Sorption Properties of Sorbents Used for Polar Organic Chemical Integrative Samplers,ENVI,Unknown,None,1
Integrated effect of aspect ratio and tree spacing on pedestrian thermal comfort of street canyon,ENVI,Unknown,None,1
"Effect of temperature, salinity and nutrients on the growth and toxin content of the dinoflagellate Gymnodinium catenatum from the southwestern Mediterranean",ENVI,Unknown,None,1
"Perfluoroalkyl substances in the meat of Polish farm animals and game – Occurrence, profiles and dietary intake",ENVI,Unknown,None,0
Setting up a CFD model to evaluate the impact of green infrastructures on local air quality,ENVI,Unknown,None,4
The microclimate implications of urban form applying computer simulation: systematic literature review,ENVI,Unknown,None,3
"GIS Application for Creating Potential Flood Map Using AHP: A Case Study in Chaq-Chaq Valley, Sulaymaniyah City, Kurdistan Region, Iraq",ENVI,Unknown,None,0
HALF-DIFFERENTIAL CAPACITIVE AIR GAP SENSOR FOR HYDROGENERATORS,ENVI,Unknown,None,0
FHPE-Net: Pedestrian Intention Prediction Using Fusion with Head Pose Estimation Based on RNN,ENVI,Unknown,None,0
Enhancing verapamil trace determination from biological matrices by bar adsorptive microextraction,ENVI,Unknown,None,0
Fluid dynamics modeling to assess the impact of urban geometry on urban microclimate,ENVI,Unknown,None,0
Preliminary Molecular Study of Chloramphenicol Anchoring on Laccase Enzyme from Trametes hirsuta,ENVI,Unknown,None,0
Pedestrian Dynamic Thermal Comfort Analysis to Optimize Using Trees in Various Urban Morphologies: A Case Study of Cairo City,ENVI,Unknown,None,0
"Numerical Study on the Summer High-Temperature Climate Adaptation of Traditional Dwellings in the Western Plains of Sichuan, China",ENVI,Unknown,None,0
Reconceptualizing and Defining Exposomics within Environmental Health: Expanding the Scope of Health Research,ENVI,Unknown,None,1
Quantifying the Impacts of Courtyard Vegetation on Thermal and Energy Performance of University Buildings in Hot Arid Regions,ENVI,Unknown,None,0
The Impact of Changes in Green Space Structures on Thermal Mitigation and Costs under a Constant Green Volume,ENVI,Unknown,None,1
Bivalves of ponds of Maine-et-Loire’s Sensitive Natural Areas: diversity and pilot study on detection by eDNA analysis.,ENVI,Unknown,None,0
Study on Summer Microclimate Analysis and Optimization Strategies for Urban Parks in Xinjiang—A Case Study of Mingzhu Park,ENVI,Unknown,None,0
"Research on the Effect of Planting Design on the Thermal Comfort of Campus Sidewalk in Tunghai University, Taiwan",ENVI,Unknown,None,0
Localization and speech-in-noise performance in a virtual reality test environment: A pilot study of adults with single-sided deafness using a cochlear implant,ENVI,Unknown,None,0
Thermomagneto-responsive injectable hydrogel for chondrogenic differentiation of mesenchymal stem cells,HEAL,Unknown,None,0
Comparison of binahong (Anredera cordifolia) (Ten. Steenis) and red betel (Piper crocatum) leaves ointment formulations toward length of laceration and bleeding time in rats,HEAL,Unknown,None,0
Additively manufactured ultrastrong and thermal-resistant Al alloy via engineering the hierarchical intermetallics,HEAL,Unknown,None,0
Si-OH defect healing treatments of ZSM-22 zeolites for enhanced performance and alcohol resistance in n-alkanes hydroisomerization,HEAL,Unknown,None,0
Sulfur Co-polymer as a universal adhesive to construct segregated structure in cross-linked rubber toward improved conductive and mechanical properties,HEAL,Unknown,None,0
"Medicinal plants used to treat human ailments in Wadla District, Northern Ethiopia: An ethnobotanical approach",HEAL,Unknown,None,0
Wound-healing activity of solvent fractions and antiinflammatory activity of crude extract and solvent fractions of Acokanthera schimperi Schweinf (Apocynaceae) leaves in mice model,HEAL,Unknown,None,0
Computerized voltage reversal prevention in second and third year 1000-liter microbial fuel cell,HEAL,Unknown,None,0
Correlating node centrality metrics with node resilience in self-healing systems with limited neighbourhood information,HEAL,Unknown,None,0
Rapid healing of internal cracks in C/C-SiC composite utilizing pure copper to improve the performance of C/C-SiC/Ti60 joints,HEAL,Unknown,None,0
3D nanofiber sponge based on natural insect quaternized chitosan/pullulan/citric acid for accelerating wound healing,HEAL,Unknown,None,0
Multiscale revelation of asphalt morphology and adhesion performance evolution during stress relaxation process,HEAL,Unknown,None,2
"A superhydrophobic Fe<inf>3</inf>O<inf>4</inf>@MSN-PDMS based composite coating with icephobicity, long-term durability and self-healing property for anti-/de-icing",HEAL,Unknown,None,0
Bio-hydrogel from RGD peptide/chitosan/β-glycerophosphate prevents postoperative wound adhesion,HEAL,Unknown,None,0
Competitive oxidation mechanism endows MXene-based supercapacitors with high-temperature tolerance and self-healing capability,HEAL,Unknown,None,0
Innate immune response to bone fracture healing,HEAL,Unknown,None,0
"A graded elastic modulus concept to eliminate stress or strain energy density singularity at sharp notches and cracks, with consequent elimination of size-scale effect on strength",HEAL,Unknown,None,0
OMIBONE: Omics-driven computer model of bone regeneration for personalized treatment,HEAL,Unknown,None,0
"Finite element analysis of crack propagation, crack-gap-filling, and recovery behavior of mechanical properties in oxidation-induced self-healing ceramics",HEAL,Unknown,None,0
"Inventory of herbal remedies used traditionally in the province of Taza, Northern Morocco: Ethnomedicinal survey",HEAL,Unknown,None,0
Expression of M1 and M2 protein around incision wound area during wound healing process on mice model for diabetes mellitus,HEAL,Unknown,None,1
The evaluation of pathologic fracture risk and residual bone height in unicortical and bicortical mandibular corpus defects: A 3D finite analysis,HEAL,Unknown,None,0
Public Theology and Its Application: A Case Study of Goryeoin Ministry in South Korea,HEAL,Unknown,None,0
Synthesis of Eucommia ulmoides-derived carbon dots for anti-inflammatory and accelerated wound healing,HEAL,Unknown,None,0
A new antibacterial with anti-inflammatory properties promotes wound healing through inhibiting cGAS/STING/NF-κB/IRF3 pathway,HEAL,Unknown,None,1
Effects of no-ozone cold plasma and mouse mesenchymal stem cell treatments on wound healing in a mouse skin model,HEAL,Unknown,None,0
The effect of hyperbaric oxygen therapy on oxidative stress and inflammation in patients with diabetic foot ulcers: A preliminary study,HEAL,Unknown,None,0
Ferrous sulfate remodels the properties of sodium alginate-based hydrogel and facilitates the healing of wound infection caused by MRSA,HEAL,Unknown,None,1
Probing the Abyss: Bacteria-based self-healing in cementitious construction materials – A Review,HEAL,Unknown,None,0
Probing the effect of selenization on RF sputtered WSe<inf>2</inf> thin films toward enhanced photoelectrochemical and photodetection performance,HEAL,Unknown,None,0
Role of inflammatory factors in diabetic ulcers and prospects of traditional Chinese medicine intervention,HEAL,Unknown,None,0
Hybrid dynamically cross-linked polyurethanes with room temperature self-healing ability for light-responsive actuator,HEAL,Unknown,None,0
DsbA-L activates TGF-β1/SMAD3 signaling and M2 macrophage polarization by stimulating AKT1 and NLRP3 to promote pulmonary fibrosis,HEAL,Unknown,None,0
Evidence-Informed Nursing Clinical Practices for Wound Debridement,HEAL,Unknown,None,0
In vitro evaluation of decellularized floral scaffold with surface nanotopography for skin tissue engineering,HEAL,Unknown,None,0
Mesenchymal stem cells lineage and their role in disease development,HEAL,Unknown,None,0
Implementing self-healing N-policy queueing models and their impact on IoT design applications,HEAL,Unknown,None,0
Hormonal interventions in skin wounds – a mini review,HEAL,Unknown,None,0
Degree of sulfation of freeze-dried calcium alginate sulfate scaffolds dramatically influence healing rate of full-thickness diabetic wounds,HEAL,Unknown,None,0
Recent Advancements in the Development of Self Healing Concrete - A Systematic Review,HEAL,Unknown,None,0
Pathological fractures of the extremities,HEAL,Unknown,None,0
Cellulose nanomaterials in oil and gas industry and bio-manufacture: Current situation and future outlook,HEAL,Unknown,None,1
Rapidly in situ forming antibiotic-free injectable hydrogel wound dressing for eradicating drug-resistant bacterial infections in human skin organoids,HEAL,Unknown,None,0
A powerful and versatile new fixation protocol for immunostaining and in situ hybridization that preserves delicate tissues,HEAL,Unknown,None,0
Advancements in skin grafting: Development and application of a novel two-blade dermatome for concurrent split-thickness and dermal graft harvesting,HEAL,Unknown,None,0
Antibacterial and wound healing stimulant nanofibrous dressing consisting of soluplus and soy protein isolate loaded with mupirocin,HEAL,Unknown,None,0
Cost-effectiveness analysis of emergency department-based hepatitis C screening and linkage-to-care program,HEAL,Unknown,None,0
Considerations of growth factor and material use in bone tissue engineering using biodegradable scaffolds in vitro and in vivo,HEAL,Unknown,None,0
Role of Ti<inf>3</inf>AlC<inf>2</inf> MAX phase in regulating biodegradation and improving electrical properties of calcium silicate ceramic for bone repair applications,HEAL,Unknown,None,0
What is psychotherapy today? From psychotherapist to “Psybot:” Towards a new definition,HEAL,Unknown,None,0
"Simvastatin and adenosine-co-loaded nanostructured lipid carriers for wound healing: Development, characterization and cell-based investigation",HEAL,Unknown,None,0
Unhelpful believes about pain. Brief pain advice in primary care,HEAL,Unknown,None,0
Repair of heat load damaged plasma–facing material using the wire-based laser metal deposition process,HEAL,Unknown,None,0
Three-dimensional anisotropic unified continuum model for simulating the healing of damaged soft biological tissues,HEAL,Unknown,None,0
"Synthesis of novel isostere analogues of naphthyridines using CuI catalyst: DFT computations (FMO, MEP), molecular docking and ADME analysis",HEAL,Unknown,None,0
Healing the high-temperature-retrogression-caused wide precipitation-free zones in Al-Zn-Mg-Cu alloy via strain-aging induced precipitates,HEAL,Unknown,None,0
Uncommon presentation of diffuse large B-cell lymphoma: oral and pulmonary involvements in a young patient: a case report,HEAL,Unknown,None,0
Evaluation of electrophotobiomodulation as a recent tool in the armamentarium of treatment of fingertip injuries,HEAL,Unknown,None,0
Distraction osteogenesis application in bone defect caused by osteomyelitis following mandibular fracture surgery: a case report and literature review,HEAL,Unknown,None,0
Navigating cardiac arrest together: A survivor and family-led co-design study of family needs and care touchpoints,HEAL,Unknown,None,0
‘I Do Not Want to Share My Pain With Anyone’—Coping With the Invisible Burden. A Qualitative Description of the Lived Experiences of Individuals With Rotator Cuff Related Shoulder Pain in an Indian Setting,HEAL,Unknown,None,0
You are not alone: Heal the P2P accommodation guests with digitally displayed close relationships,HEAL,Unknown,None,0
Mechanism of DT-13 regulating macrophages in diabetic wound healing,HEAL,Unknown,None,0
Ileoanal pouch salvage rates with endoluminal vacuum therapy for early vs late anastomotic leaks,HEAL,Unknown,None,0
Functional electrospinning Janus dressings with asymmetric surface wettability,HEAL,Unknown,None,1
"Exosomes and microRNAs: insights into their roles in thermal-induced skin injury, wound healing and scarring",HEAL,Unknown,None,0
Novel cold asphalt mixture featuring fast curing and self-healing by means of magnetic induction,HEAL,Unknown,None,0
Editorial Commentary: Primary Repair of the Anterior Cruciate Ligament Shows Positive Midterm Outcomes When Properly Indicated,HEAL,Unknown,None,0
Essential oils: a potential alternative with promising active ingredients for pharmaceutical formulations in chronic wound management,HEAL,Unknown,None,1
Edge De-epithelialization for Reducing Pharyngocutaneous Fistula in Patch Free Flap Reconstructions for Salvage Total Laryngectomy Defects: A Case-Control Study,HEAL,Unknown,None,0
Ferroelastic ionic organic crystals that self-heal to 95%,HEAL,Unknown,None,0
"Enhancing wound healing with zinc and silver nanocomposites synthesized with β-lactoglobulin: antimicrobial properties, collagen deposition, and systemic effects in a C57BL/6J mouse model",HEAL,Unknown,None,0
Permeability and self-healing behavior of alkali activated geopolymers for well cementing applications,HEAL,Unknown,None,0
Biomechanical validation of a tibial critical-size defect model in minipigs,HEAL,Unknown,None,0
"Soft bandage, splint or cast as the treatment of distal forearm torus fracture in children: a systematic review and meta-analysis",HEAL,Unknown,None,0
The journey of antibody-drug conjugates for revolutionizing cancer therapy: A review,IMMU,Unknown,None,0
Plasma exchange as an effective treatment for cytokine release syndrome following T cell receptor‑engineered T cell immunotherapy: A case report,IMMU,Unknown,None,0
Nervonic acid improves fat transplantation by promoting adipogenesis and angiogenesis,IMMU,Unknown,None,0
Establishing a model composed of immune-related gene-modules to predict tumor immunotherapy response,IMMU,Unknown,None,0
A new TROP2-targeting antibody-drug conjugate shows potent antitumor efficacy in breast and lung cancers,IMMU,Unknown,None,1
Meiotic protein SYCP2 confers resistance to DNA-damaging agents through R-loop-mediated DNA repair,IMMU,Unknown,None,2
Determination of Feed Zearalenone Content Using High-Throughput Automatic Immunomagnetic Beads Purification Combined with High-Performance Liquid Chromatography,IMMU,Unknown,None,0
Sacituzumab Govitecan in Triple Negative Breast Cancer: A Systematic Review of Clinical Trials,IMMU,Unknown,None,0
Acid-sensitive prodrugs; a promising approach for site-specific and targeted drug release,IMMU,Unknown,None,3
Alvianolic acid B exerts a protective effect on random skin flaps through autophagy mediated by activation of TFE3,IMMU,Unknown,None,0
Evolving approaches in advanced gallbladder cancer with complete pathological response using chemo‑immunotherapy: A case report,IMMU,Unknown,None,0
Adiponectin receptor 1 regulates endometrial receptivity via the adenosine monophosphate‑activated protein kinase/E‑cadherin pathway,IMMU,Unknown,None,0
"The Effect of Fermented Wheat Germ Extract on Broiler Chicks' Growth Performance, Immunological Status, and Carcass Characteristics",IMMU,Unknown,None,2
Effect of whittenolactone II on apoptosis of lung cancer mice based on JAK2/STAT3/PDL1 pathway,IMMU,Unknown,None,0
"Effects of Licorice and Picrasma quassioides Extract and Montmorillonite on Growth Performance, Diarrhea Rate and Serum Indices of Suckling Calves",IMMU,Unknown,None,0
A pilot study on the detection of microsatellite instability using long mononucleotide repeats in solid tumors,IMMU,Unknown,None,0
"On the shoulder of ADC: The development of <sup>124</sup>I-IMMU-132, an iodine-124-labelled Trop-2-targeting molecular probe for micro-PET imaging",IMMU,Unknown,None,0
Exploring the potential of the TCR repertoire as a tumor biomarker (Review),IMMU,Unknown,None,1
A Rare Case Report: ICOS and WIPF1 Mutation Together in A Patient,IMMU,Unknown,None,1
Cognition and Oral Health: Association Between Alzheimer’s Disease and Periodontitis,IMMU,Unknown,None,1
Gene expression profiling and the isocitrate dehydrogenase mutational landscape of temozolomide‑resistant glioblastoma,IMMU,Unknown,None,0
Therapeutic effect of ginger on gastritis: Regulation of STAT3/MAPK signaling pathway and gastrointestinal hormone balance,IMMU,Unknown,None,0
Good clinical response following Ibrutinib treatment of a rare case of lymphoplasmacytic lymphoma secreting IgA kappa paraprotein: A case report,IMMU,Unknown,None,0
Construction of an immune-related gene prognostic model with experimental validation and analysis of immune cell infiltration in lung adenocarcinoma,IMMU,Unknown,None,1
DGEMM on integer matrix multiplication unit,IMMU,Unknown,None,0
Specific Cell Targeting by Toxoplasma gondii Displaying Functional Single-Chain Variable Fragment as a Novel Strategy; A Proof of Principle,IMMU,Unknown,None,0
DEFA1A3 DNA gene-dosage regulates the kidney innate immune response during upper urinary tract infection,IMMU,Unknown,None,0
Experiences of a CAEV (Caprine arthritis encephalitis virus) eradication programme in an alpine goat farm,IMMU,Unknown,None,0
Hematological and physiological responses in polo ponies with different field-play positions during low-goal polo matches,IMMU,Unknown,None,1
Cell-Surface ZnT8 Antibody Prevents and Reverses Autoimmune Diabetes in Mice,IMMU,Unknown,None,2
