title,query_subject,subjects,keywords,cited_by
Investigating uncertainties in air quality models used in GMAP/SIJAQ 2021 field campaign: General performance of different models and ensemble results,CHEM,Unknown,None,0
Unexpected increase in microalgal removal of doxylamine induced by bicarbonate addition: synergistic chem-/bio-degradation mechanisms,CHEM,Unknown,None,0
On Wiener-Type Topological Indices and Their Reciprocals,CHEM,Unknown,None,0
On Relations between Distance–Based Topological Indices,CHEM,Unknown,None,0
"Corrigendum to “Synthesis of CuO/MnAl2O4 nanocomposite as electrocatalysts for robust oxygen evolution reaction” [J. Phys. Chem. Solids Volume 193, October 2024, 112121] (Journal of Physics and Chemistry of Solids (2024) 193, (S0022369724002567), (10.1016/j.jpcs.2024.112121))",CHEM,Unknown,None,0
"Corrigendum to “Facile barometric calibration of photoluminescence-based oxygen sensors on a standard rotary evaporator system with a digital vacuum pump” [Sens. Actuators B Chem. 418 (2024) 136286] (Sensors and Actuators: B. Chemical (2024) 418, (S0925400524010165), (10.1016/j.snb.2024.136286))",CHEM,Unknown,None,0
Viscosity of deep eutectic solvents: Predictive modeling with experimental validation,CHEM,Unknown,None,0
A new antibacterial with anti-inflammatory properties promotes wound healing through inhibiting cGAS/STING/NF-κB/IRF3 pathway,CHEM,Unknown,None,1
Development of the CMA-ChemRA: China Regional Weakly Coupled Chemical-Weather Reanalysis System with product since 2007,CHEM,Unknown,None,0
Corrigendum to “Co-doped hollow nanospheres with low Pt loading for electrocatalytic oxygen reduction and zinc-air batteries” [J. Electroanal. Chem. 967(2024) 118449](S1572665724004272)(10.1016/j.jelechem.2024.118449),CHEM,Unknown,None,0
Effects of valley topography on ozone pollution in the Lanzhou valley: A numerical case study,CHEM,Unknown,None,0
"Elucidating the impacts of aerosol radiative effects for mitigating surface O<inf>3</inf> and PM<inf>2.5</inf> in Delhi, India during crop residue burning period",CHEM,Unknown,None,0
Inter-annual changes in transboundary air quality from KORUS-AQ 2016 to SIJAQ 2022 campaign periods and assessment of emission reduction strategies in Northeast Asia,CHEM,Unknown,None,0
"Corrigendum to “Novel Platinum(IV) complexes intervene oxaliplatin resistance in colon cancer via inducing ferroptosis and apoptosis” [Eur. J. Med. Chem. 263 (2024) 115968] (European Journal of Medicinal Chemistry (2024) 263, (S0223523423009352), (10.1016/j.ejmech.2023.115968))",CHEM,Unknown,None,0
"Corrigendum to “Novel Nitric oxide-releasing derivatives of pyranocarbazole as antitumor agents: Design, synthesis, biological evaluation, and nitric oxide release studies” [Eur. J. Med. Chem. 244 (2022) 114832 / EJMECH-D-22-01635R2] (European Journal of Medicinal Chemistry (2022) 244, (S0223523422007346), (10.1016/j.ejmech.2022.114832))",CHEM,Unknown,None,0
Intercomparison of WRF-chem aerosol schemes during a dry Saharan dust outbreak in Southern Iberian Peninsula,CHEM,Unknown,None,0
"The impact of exposure assessment on associations between air pollution and cardiovascular mortality risks in the city of Rio de Janeiro, Brazil",CHEM,Unknown,None,0
Impact of urbanized atmosphere-land processing to the near-ground distribution of air pollution over Central Liaoning Urban Agglomeration,CHEM,Unknown,None,0
How accurate can Kohn-Sham density functional be for both main-group and transition metal reactions,CHEM,Unknown,None,0
Structure and intermolecular interactions in ionic liquid 1-ethyl-3-methylimidazolium bromide and its aqueous solutions investigated by vibrational spectroscopy and quantum chemical computations,CHEM,Unknown,None,0
Chemo-elasto-electro free energy of non-uniform system in the diffuse interface context,CHEM,Unknown,None,0
"Erratum: Inhaled aptamer therapy: A hopeful therapy for lung disease (Molecular Therapy - Nucleic Acids (2023) 32 (875–876), (S2162253123001269), (10.1016/j.omtn.2023.05.009))",CHEM,Unknown,None,0
A mixed layer height parameterization in a 3-D chemical transport model: Implications for gas and aerosol simulations,CHEM,Unknown,None,0
"Corrigendum to “Breakthroughs in AI and multi-omics for cancer drug discovery: A review” [Eur. J. Med. Chem. 280 (2024) 1-21, 116925] (European Journal of Medicinal Chemistry (2024) 280, (S0223523424008067), (10.1016/j.ejmech.2024.116925))",CHEM,Unknown,None,0
"Corrigendum to “Numerical simulation study of the influence of stirred vessel structure on particle suspension characteristics in dilute solutions” [Chem. Eng. Sci. 300 (2024) 120587] (Chemical Engineering Science (2024) 300, (S000925092400887X), (10.1016/j.ces.2024.120587))",CHEM,Unknown,None,0
"Corrigendum to ‘Removal of Cd(II) and Pb(II) from synthetic wastewater using Rosa damascena waste as a biosorbent: An insight into adsorption mechanisms, kinetics, and thermodynamic studies’ [Chem. Eng. Sci. 280 (2023) 119072] (Chemical Engineering Science (2023) 280, (S0009250923006280), (10.1016/j.ces.2023.119072))",CHEM,Unknown,None,0
Fault-tolerant quantum chemical calculations with improved machine-learning models,CHEM,Unknown,None,0
"Rho-associated, coiled-coil-containing protein kinase 2 regulates expression of mineralocorticoid receptor to mediate sodium reabsorption in mice",CHEM,Unknown,None,0
"Corrigendum to “Enhanced DeNOx catalysis: Induction-heating-catalysis-ready 3D stable Ni supported metal combinations” [Chem. Eng. Res. Des. 207 (2024) 404–419, (S0263876224003496), (10.1016/j.cherd.2024.06.019)]",CHEM,Unknown,None,0
MQMAS spectra of half-integer quadrupolar nuclei enhanced by indirect DNP,CHEM,Unknown,None,0
"Contribution of the anthropogenic precursor emission from multiple sectors to the tropospheric ozone concentrations: A case study in Henan Province, China",CHEM,Unknown,None,0
The interplay of mineral dust with radiation: analysis of the giant dust intrusion in the Atlantic Ocean on June 2020,CHEM,Unknown,None,0
A kinetic and mechanistic study of the self-reaction between two propargyl radicals,CHEM,Unknown,None,0
Controlled release of hydrogel-encapsulated mesenchymal stem cells-conditioned medium promotes functional liver regeneration after hepatectomy in metabolic dysfunction-associated steatotic liver disease,CHEM,Unknown,None,0
"Low-energy (0-9 eV) electron interaction with gas phase 1,3-dichlorobenzene: an experimental and theoretical study",CHEM,Unknown,None,0
"Corrigendum to “Compounds for selective translational inhibition” [Curr Opin Chem Biol 69 (2022) 102158] (Current Opinion in Chemical Biology (2022) 69, (S1367593122000436), (10.1016/j.cbpa.2022.102158))",CHEM,Unknown,None,0
Comparison of global air pollution impacts across horizontal resolutions,CHEM,Unknown,None,0
Longitudinal evaluation of liver stiffness reveals hepatic cholesterol as the determinant of fibrosis progression in mice,CHEM,Unknown,None,0
Chicken chemerin alone or in mixture with adiponectin-visfatin impairs progesterone secretion by primary hen granulosa cells,CHEM,Unknown,None,0
"Corrigendum to “Discovering common pathogenetic processes between polycystic ovary syndrome and uterine corpus endometrial carcinoma by bioinformatics and experimental approach” [Arab. J. Chem. 17 (2024) 105548] (Arabian Journal of Chemistry (2024) 17(2), (S1878535223010109), (10.1016/j.arabjc.2023.105548))",CHEM,Unknown,None,0
"Corrigendum to “Fluorescence detection setups in capillary electrophoresis and microscale liquid chromatography: Developments over the past decade” [Trends Anal. Chem. 181 (2024) 118001] (Trends in Analytical Chemistry (2024) 181(PA), (S0165993624004849), (10.1016/j.trac.2024.118001))",CHEM,Unknown,None,0
"Corrigendum to “Magnetic and microwave properties of Co<inf>0.5</inf>Ni<inf>0.5</inf>Fe<inf>2-</inf><inf>x</inf>Sc<inf>x</inf>O<inf>4</inf> (0.0 ≤ x ≤ 0.1) nanosized spinel ferrites” [Inorg. Chem. Commun. 151 (2023) 110574] (Inorganic Chemistry Communications (2023) 151, (S1387700323001867), (10.1016/j.inoche.2023.110574))",CHEM,Unknown,None,0
"Corrigendum to “ZnO/AgSbO3 as an improved nanophotocatalyst in the synthesis of some naphthopyranopyrimidines” [Inorg. Chem. Commun. Volume 170, Part 1, (2024) 113212](S1387700324011997)(10.1016/j.inoche.2024.113212)",CHEM,Unknown,None,0
"Predictive, integrative, and regulatory aspects of AI-driven computational toxicology – Highlights of the German Pharm-Tox Summit (GPTS) 2024",CHEM,Unknown,None,0
Comments on: “Low temperature engineering feasibility of high reflective Ag–Sn films from experimental and thermodynamic views” [Mater. Phys. Chem. 254 (2020) 123490],CHEM,Unknown,None,0
"Erratum to “Palladium (II)-catalyzed cascade reactions initiated with directed activation of unactivated sp<sup>3</sup> C–H bonds” [Tetrahedron Chem 7 (2023) 100046] (Tetrahedron Chem (2023) 7, (S2666951X23000128), (10.1016/j.tchem.2023.100046))",CHEM,Unknown,None,0
Clinical Utility of Circulating Cell-Free DNA as a Liquid Biopsy in Cats With Various Tumours,CHEM,Unknown,None,0
"Erratum to “Reactivities and mechanisms in organic reactions involving activation of elemental sulfur under basic conditions” [Tetrahedron Chem 11 (2024) 100086] (Tetrahedron Chem (2024) 11, (S2666951X24000251), (10.1016/j.tchem.2024.100086))",CHEM,Unknown,None,0
"Erratum to “Hydrogen bond-mediated organocatalytic enantioselective reduction of nitroalkenes in deep eutectic solvents” [Tetrahedron Chem 6 (2023) 100038] (Tetrahedron Chem (2023) 6, (S2666951X23000049), (10.1016/j.tchem.2023.100038))",CHEM,Unknown,None,0
"A comparison of meteorological normalization of PM<inf>2.5</inf> by multiple linear regression, general additive model, and random forest methods",CHEM,Unknown,None,0
"Erratum to “Organocatalytic asymmetric synthesis of bioactive hexahydropyrrolo[2,3-b]indole-containing tetrasubstituted allenes bearing multiple chiral elements” [Tetrahedron Chem 1 (2022) 100007] (Tetrahedron Chem (2022) 1, (S2666951X22000031), (10.1016/j.tchem.2022.100007))",CHEM,Unknown,None,0
"Erratum to “Enantioselective α-heterofunctionalization reactions of catalytically generated C1-Lewis base enolates” [Tetrahedron Chem 9 (2024) 100063] (Tetrahedron Chem (2024) 9, (S2666951X24000020), (10.1016/j.tchem.2024.100063))",CHEM,Unknown,None,0
"Erratum to “Latest updates in ElectroPhotoChemical reactions” [Tetrahedron Chem 9 (2024) 100061] (Tetrahedron Chem (2024) 9, (S2666951X2300027X), (10.1016/j.tchem.2023.100061))",CHEM,Unknown,None,0
Disentangling the effects of meteorology and emissions from anthropogenic and biogenic sources on the increased surface ozone in Eastern China,CHEM,Unknown,None,0
"Corrigendum to “Industrial view on hydrogen carriers for intercontinental transport” [Curr Opin Green Sustain Chem (44) (2023) 100843] (Current Opinion in Green and Sustainable Chemistry (2023) 44, (S2452223623000913), (10.1016/j.cogsc.2023.100843))",CHEM,Unknown,None,0
"Correction to: Genetic Evaluation of the Patients with Clinically Diagnosed Inborn Errors of Immunity by Whole Exome Sequencing: Results from a Specialized Research Center for Immunodeficiency in Türkiye (Journal of Clinical Immunology, (2024), 44, 7, (157), 10.1007/s10875-024-01759-w)",COMP,Unknown,None,0
Graph convolutional network for compositional data,COMP,Unknown,None,0
Case law in European merger control,COMP,Unknown,None,0
An integrated off-lattice kinetic Monte Carlo (KMC)-molecular dynamics (MD) framework for modeling polyvinyl chloride dehydrochlorination,COMP,Unknown,None,0
Don't break the (blood) bank: Can waste be minimized in a whole blood program?,COMP,Unknown,None,0
Binary classification from N-Tuple Comparisons data,COMP,Unknown,None,0
Improvement of the safety of artisanal Spanish fermented sausages: Spotlight on the role of bacteriocinogenic Lactiplantibacillus paraplantarum against a Companilactobacillus alimentarius histaminogenic strain,COMP,Unknown,None,0
Single-dose psilocybin for U.S. military Veterans with severe treatment-resistant depression – A first-in-kind open-label pilot study,COMP,Unknown,None,0
The ARCH-COMP Friendly Verification Competition for Continuous and Hybrid Systems,COMP,Unknown,None,0
ProtoComp: Diverse Point Cloud Completion with Controllable Prototype,COMP,Unknown,None,0
Competition of Solvers for Constrained Horn Clauses (CHC-COMP 2023),COMP,Unknown,None,0
Cross Modality Fusion Network with Feature Alignment and Salient Object Exchange for Single Image 3D Shape Retrieval,COMP,Unknown,None,0
Modeling pulmonary perfusion and gas exchange in alveolar microstructures,COMP,Unknown,None,0
EXTENDING ERROR BOUNDS FOR RADIAL BASIS FUNCTION INTERPOLATION TO MEASURING THE ERROR IN HIGHER ORDER SOBOLEV NORMS,COMP,Unknown,None,0
Fault Localization on Verification Witnesses,COMP,Unknown,None,0
Solving Constrained Horn Clauses as C Programs with CHC2C,COMP,Unknown,None,0
FM-Weck: Containerized Execution of Formal-Methods Tools,COMP,Unknown,None,0
Exploring Loose Coupling of Slicing with Dynamic Symbolic Execution on the JVM,COMP,Unknown,None,0
Refining CEGAR-Based Test-Case Generation with Feasibility Annotations,COMP,Unknown,None,0
Cut-down de Bruijn sequences,COMP,Unknown,None,0
Simulated microgravity environment inhibits matrix mineralization during the osteoblast to osteocyte differentiation,COMP,Unknown,None,0
Maternal and cord blood levels of metals and fetal liver function,COMP,Unknown,None,0
Assessing the external atmospheric input of microplastics: Two strategies based on polymer composition and aging characteristics,COMP,Unknown,None,0
Structural and catalytic properties of histidyl-tRNA synthetase: A potential drug target against leishmaniasis,COMP,Unknown,None,0
AC loss and shielding in stacks of coated conductors: Analytic modelling and comparison to experiment,COMP,Unknown,None,1
The impact of antidepressant discontinuation prior to treatment with psilocybin for treatment-resistant depression,COMP,Unknown,None,0
An ANN enabled joint power allocation and base station switching system for EE heterogeneous networks,COMP,Unknown,None,0
"Uncovering the relationship between trace element exposure, cognitive function, and dietary inflammation index in elderly americans from the National Health and Nutrition Examination Survey 2011–2014",COMP,Unknown,None,0
Construction of an artificial neural network diagnostic model and investigation of immune cell infiltration characteristics for idiopathic pulmonary fibrosis,COMP,Unknown,None,1
An energy-efficient JT-CoMP enabled framework with adaptive OMA/NOMA in HetNets,COMP,Unknown,None,0
Chromatographic fingerprinting of ipratropium and fenoterol in their novel co-formulated inhaler treating major respiratory disorders; application to delivered dose uniformity testing along with greenness and whiteness assessment,COMP,Unknown,None,2
Analysis and study on biomarkers of local muscle fatigue caused by repetitive lifting task,COMP,Unknown,None,0
Nominal VP anaphora in Scandinavian and English,COMP,Unknown,None,0
Consumer eating quality and physicochemical traits of pork Longissimus and Semimembranosus differed between genetic lines,COMP,Unknown,None,0
"Association of serum biomarkers with radiographic knee osteoarthritis, knee pain and function in a young, male, trauma-exposed population – Findings from the ADVANCE study",COMP,Unknown,None,0
BsuMI regulates DNA transformation in Bacillus subtilis besides the defense system and the constructed strain with BsuMI-absence is applicable as a universal transformation platform for wild-type Bacillus,COMP,Unknown,None,0
Synovial expression of glucocorticoid receptor parallels fibroblast activation in patients with rheumatoid arthritis,COMP,Unknown,None,0
Detect-order-construct: A tree construction based approach for hierarchical document structure analysis,COMP,Unknown,None,1
Association of Mesoscale Features With Tropical Cyclone Tauktae,COMP,Unknown,None,0
Proteomic profiling of prostate cancer reveals molecular signatures under antiandrogen treatment,COMP,Unknown,None,0
Enhanced multi view 3D reconstruction with improved MVSNet,COMP,Unknown,None,0
"Author Correction: Developing a prognostic model using machine learning for disulfidptosis related lncRNA in lung adenocarcinoma (Scientific Reports, (2024), 14, 1, (13113), 10.1038/s41598-024-63949-1)",COMP,Unknown,None,0
Fatigue and failure mode analyses of glass infiltrated 5Y-PSZ bonded onto dentin analogues,COMP,Unknown,None,0
Parallel program analysis on path ranges,COMP,Unknown,None,0
Relationships between minerals’ intake and blood homocysteine levels based on three machine learning methods: a large cross-sectional study,COMP,Unknown,None,0
Integrating bulk RNA-seq and scRNA-seq analyses revealed the function and clinical value of thrombospondins in colon cancer,COMP,Unknown,None,0
Simulated lunar microgravity transiently arrests growth and induces osteocyte-chondrocyte lineage differentiation in human Wharton’s jelly stem cells,COMP,Unknown,None,1
Identification and characterization of a new potent inhibitor targeting CtBP1/BARS in melanoma cells,COMP,Unknown,None,1
Stromal cartilage oligomeric matrix protein as a tumorigenic driver in ovarian cancer via Notch3 signaling and epithelial-to-mesenchymal transition,COMP,Unknown,None,1
Genetic analysis of scab disease resistance in common bean (Phaseolus vulgaris) varieties using GWAS and functional genomics approaches,COMP,Unknown,None,1
HAPLN1 knockdown inhibits heart failure development via activating the PKA signaling pathway,COMP,Unknown,None,1
Diagnostic value of serum COMP and ADAMTS7 for intervertebral disc degeneration,COMP,Unknown,None,1
Respiratory distress in SARS-CoV-2 exposed uninfected neonates followed in the COVID Outcomes in Mother-Infant Pairs (COMP) Study,COMP,Unknown,None,11
Association of cartilage metabolism biomarkers and 25(OH)D levels with muscle biomechanical functions in professional rowers and canoeists,COMP,Unknown,None,0
Low-Grade Inflammatory Mediators and Metalloproteinases Yield Synchronous and Delayed Responses to Mechanical Joint Loading,COMP,Unknown,None,0
Triglyceride-glucose Index and Its combination with obesity indicators mediating the association between 2-hydroxyfluorene and the prevalence of cardiovascular disease: Evidence from the NHANES (2005–2018),COMP,Unknown,None,0
Evaluation of serum biomarkers after intra-articular injection of rat bone marrow-derived mesenchymal stem cells in a rat model of knee osteoarthritis,COMP,Unknown,None,0
Internet of things platforms adoption in agriculture: comparative theoretical models,COMP,Unknown,None,0
Endonuclear Circ-calm4 regulates ferroptosis via a circR-Loop of the COMP gene in pulmonary artery smooth muscle cells,COMP,Unknown,None,0
Comparative Analysis of Plasma Protein Dynamics in Women with ST-Elevation Myocardial Infarction and Takotsubo Syndrome,COMP,Unknown,None,0
"Corrigendum to “Effective and scalable black-box fuzzing approach for modern web applications” [J. King Saud Univ. Comp. Info. Sci. 34(10) (2022) 10068–10078, (S1319157822003573), (10.1016/j.jksuci.2022.10.006)]",COMP,Unknown,None,0
Antifungal properties of abnormal cannabinoid derivatives: Disruption of biofilm formation and gene expression in Candida species,COMP,Unknown,None,0
"Nicotine pouch use by sex, school type and tobacco product use among Finnish adolescents during the 2023 change in regulatory scheme with deregulated sales",COMP,Unknown,None,0
The localized Gouvêa–Mazur conjecture,COMP,Unknown,None,1
Strategies for solving multiplicative problems using a conceptual model-based problem-solving approach. A case study with a student with autism spectrum disorder,COMP,Unknown,None,1
"Enhancing collagen based nanoemulgel for effective topical delivery of Aceclofenac and Citronellol oil: Formulation, optimization, in-vitro evaluation, and in-vivo osteoarthritis study with a focus on HMGB-1/RAGE/NF-κB pathway, Klotho, and miR-499a",COMP,Unknown,None,1
Nitrogen use efficiency of open-pollinated maize cultivars and topcrosses under low nitrogen soil,COMP,Unknown,None,0
Electrochemical Selective Removal of Oxyanions in a Ferrocene-Doped Metal-Organic Framework,COMP,Unknown,None,0
New Localization Frameworks: User-centric Approaches to Source Localization in Real-world Propagation Scenarios,COMP,Unknown,None,0
Effect of Comp on Colorectal Cancer Cell Migration,COMP,Unknown,None,0
ICBET 2024 - Proceedings of the 2024 14th International Conference on Biomedical Engineering and Technology,COMP,Unknown,None,0
Sequential Targeted Enzyme-Instructed Self-Assembly Supramolecular Nanofibers to Attenuate Intervertebral Disc Degeneration,COMP,Unknown,None,1
"Use of Indigenous Lactic Acid Bacteria for Industrial Fermented Sausage Production: Microbiological, Chemico-Physical and Sensory Features and Biogenic Amine Content",COMP,Unknown,None,0
Comparative transcriptomic analysis of articular cartilage of post-traumatic osteoarthritis models,COMP,Unknown,None,0
Preventive and treatment efficiency of dendrosomal nano-curcumin against ISO-induced cardiac fibrosis in mouse model,COMP,Unknown,None,0
Evaluation of psychometric characteristics of employee motivation in the workplace,DECI,Unknown,None,0
"Parenting, self-regulation, and sibling relationship dynamics in early childhood",DECI,Unknown,None,0
Question banks: credit? Or debit? A qualitative exploration of their use among medical students,DECI,Unknown,None,1
"AI learning intention, learning engagement and behavioral outcomes: an empirical study",DECI,Unknown,None,0
"Facilitators and barriers to decision-making for hospital treatment among patients diagnosed with breast cancer in Dar es Salaam, Tanzania: A qualitative urban-based study",DECI,Unknown,None,0
Feasibility of loop-gain tuning for general measurement systems inspired by quantum locking for DECIGO,DECI,Unknown,None,0
Student behavior at university: The development and validation of a 10-dimensional scale,DECI,Unknown,None,0
Beyond the Meaning of Pain: Optimal Pain Assessment Tools for (Unable to Self-Report) Critically Ill Patients: A Narrative Review,DECI,Unknown,None,0
Agencification in the EU Energy Sector: A Case Study on Delegation and Margin of Discretion in EU Electricity Market Rule-making,DECI,Unknown,None,0
"Forms of Job Satisfaction. A Test of the Assumptions of Bruggemann’s Model Regarding the Role of Actual-Standard Comparison, Regulation of Aspiration Level, and Problem-Solving Attempts (Finally)",DECI,Unknown,None,0
The Natural Pattern-based Fuzzy Investment System,DECI,Unknown,None,0
Gravitational memory signal from neutrino self-interactions in supernova,DECI,Unknown,None,0
Ionic liquid-induced aggregation behavior of kryptocyanine dye,DECI,Unknown,None,0
"The theoretical-dogmatic issues of res judicata, both formal and material, in Colombian constitutional case law",DECI,Unknown,None,0
Unraveling Stereochemical Structure-Activity Relationships of Sesquiterpene Lactones for Inhibitory Effects on STAT3 Activation,DECI,Unknown,None,1
Enhancing Supply Chain Agility and Sustainability through Machine Learning: Optimization Techniques for Logistics and Inventory Management,DECI,Unknown,None,4
Data and Computation-Intensive Service Reconfiguration with Low Cost of Imbalanced Resources in Edge Networks,DECI,Unknown,None,0
Stochastic Gravitational Wave Background from Cosmological Neutrino-dominated Accretion Flows,DECI,Unknown,None,0
Identifying the Most Cited Articles and Authors in Educational Psychology Journals from 1988 to 2023,DECI,Unknown,None,2
Parents Between Family and Work: The Role of Psychological Needs Satisfaction,DECI,Unknown,None,1
Is the future of work hybrid? Examining motivations and expectations related to working from home in knowledge workers' lived experiences,DECI,Unknown,None,0
Surgical decision-making types and its influencing factors for obesity patients participating in bariatric metabolic surgery,DECI,Unknown,None,0
Deci-Hz gravitational waves from the self-interacting axion cloud around a rotating stellar mass black hole,DECI,Unknown,None,1
"Manned/unmanned aerial vehicle cooperative combat system: Concepts, technologies, and challenges",DECI,Unknown,None,1
HORIZONTAL FISCAL IMBALANCES IN MEDIUM-SIZED MUNICIPALITIES IN MEXICO,DECI,Unknown,None,0
Men in Feminism: A Self-Determination Perspective and Goals for the Future,DECI,Unknown,None,1
Detection of soil-transmitted helminths and Schistosoma spp. by nucleic acid amplification test: Results of the first 5 years of the only international external quality assessment scheme,DECI,Unknown,None,1
Self-determination theory and its predictors for sharing knowledge: a critical review,DECI,Unknown,None,4
Basic psychological needs in Alzheimer's disease: A self-determination theory perspective,DECI,Unknown,None,0
THE MOTIVATION OF TEACHERS IN PORTUGAL - A CASE STUDY IN PORTUGUESE PUBLIC SCHOOLS,DECI,Unknown,None,0
In the name of God… and the Republic. Anti-Franco Catholics and the Holy See in the long postwar period (1939-1953),DECI,Unknown,None,0
DECI: The 2<sup>nd</sup>Tutorial on Designing Effective Conversational Interfaces,DECI,Unknown,None,0
What Is Behind Motivating and Demotivating Styles of Interaction with Students: The Role of the Teacher's Personal Potential,DECI,Unknown,None,0
Ultrastable Space Laser Technology (Invited),DECI,Unknown,None,0
Low Frequency Hierarchical Cooperative Impulse Control for Gravitational Wave Detector Formation Keeping,DECI,Unknown,None,0
Basic psychological needs: A framework for understanding childbirth satisfaction,DECI,Unknown,None,1
